label	title
unacceptable	バイト橋本環奈にすぐ働けてすぐお金がもらえる！メンドウな面接や履歴書も一切必要ありません！
unacceptable	浴室・トイレ人探し値段・洗面所・換気扇など水回りの掃除はプロにお任せ!隅々までピカピカに。
acceptable	【清掃会社】フランチャイズで探す
acceptable	住宅展示場の検索ができる
unacceptable	がん保険の評判悪い?
acceptable	費用や料金体系はこちらから
unacceptable	全国のシロアリ検査費用・トイレ・広告・ウェブサイトなど、プロにお任せ!隅々までピカピカに。
unacceptable	「タイミーコールセンター」
acceptable	単発・未経験OKなど条件で探せるバイト情報掲載。スキマ時間にすぐ働けてすぐお金がもらえる！
acceptable	単発・日払いバイトが充実
acceptable	安心の30日間保証
acceptable	大手だから安心!洗濯機掃除代行
acceptable	キャッシングサービスもあり
acceptable	プロの技術でお部屋をキレイに
unacceptable	豊富な物件情報でこだわり条件の賃貸情報サイトを滋賀で。初期費用などのお問合わせ無料！
unacceptable	化粧水・乳液状美容液で簡単2stepケア。乾燥、小ジワ、尽きない女性ブライトエイジの悩みへ
unacceptable	滋賀県賃貸マンション物件あり
acceptable	DXを自社アプリで解決
unacceptable	【公式】旧資金援助
unacceptable	アンテナ水漏れ費用なら
acceptable	ブライトエイジ化粧品の口コミ
acceptable	選べるオプション(特約)
unacceptable	楽天カードおすすめ学生はコチラ
acceptable	掃除の会社」のfc加盟店を独立開業を。研修が充実して安心・約95%の方が掃除業者の仕事未経験で活躍
acceptable	ハイゼットカーゴの中古車探し
unacceptable	ブライダルフェア サイト
acceptable	賃貸マンション・アパート・一戸建て情報検索。一人暮らし、ペット可など人気のテーマ特集も!
acceptable	20年以上支持されてきたおそうじ本舗のブランド
unacceptable	【ネズミ業者業者】
acceptable	ハウスクリーニング」を検索/絞込条件を変更しておそうじ本舗を検索してください。おそうじ本舗があなたにぴったりのお掃除代行をご紹介します。
unacceptable	インターネット申込みなら、一度のお手続きでメディケア生命！ネットで簡単スムーズに申込み。
unacceptable	【公式】出雲アパート物件あり
unacceptable	【公式】鳥取ガスガス料金支払い
acceptable	掃除のプロ」が主宰
acceptable	クーラークリーニングなら
unacceptable	≪簡単2分≫質問事項に答えるだけで依頼完了!エアコンスズメバチの巣に強いプロから見積もりが。
acceptable	【掃除のフランチャイズ】なら楽宅便
acceptable	パソコンデスク、ラックの通販。タワー型・マウント型ラックも豊富にご用意！
acceptable	【公式】ブライトエイジシミ
acceptable	リングライトを法人価格で購入。WEBカメラ／モバイルバッテリーなど、PC周辺機器を多数取り揃え
acceptable	【コールセンター】派遣求人を探すなら
acceptable	【スタディサプリENGLISH】公式
acceptable	【安来市】賃貸・アパートを検索
unacceptable	行橋駅の新築戸建て情報はこちらから・毎日豊富な新着物件を様々な条件で探せる。
unacceptable	全国のシロアリの駆除、雨の日には洗濯物の乾燥機能が大活躍。便利な機能で生活をもっと快適に。
unacceptable	県民共済 岡山中央自動車保険は保険料が無料、かつ保障内容も充実!詳細はこちら。
acceptable	【おすすめのセール対象作品が充実】話題のBL・TL漫画を無料で試し読み！人気BL・TL漫画が充実
unacceptable	富士フイルムの美白ケア・富士フイルムの技術ですみずみまでうるおいを。
unacceptable	豊富な物件情報でこだわり条件の賃貸情報サイトを滋賀で。初期費用の問い合わせもカンタン！
acceptable	チラシ制作するなら
acceptable	【ゼクシィ】結婚式場
unacceptable	2022年医療保険死亡保障安い
unacceptable	約100種の条件からあなたにマッチした松本市の賃貸アパートを選べる・賃貸情報サイト CHINTAI。
unacceptable	エトヴォス誕生日
acceptable	東淀川区 介護職の求人情報
acceptable	掃除のプロが店舗売り上げアップ支援
unacceptable	大宮不動産売却売却
acceptable	チャットで依頼できる
unacceptable	エルグランドの式場
unacceptable	一宮アパート情報賃貸物件
unacceptable	シミュレーションでアナタの保険料や保障がん保険おすすめ50代安い・保障期間で保険を比較できる
acceptable	掃除の会社を独立開業を」とお考えのあなたへ。おそうじ本舗なら徹底サポート・研修体制をご用意。ハウスクリーニング業界未経験でも安心・安定して独立・開業・起業!
unacceptable	エトヴォスetvosスターター
acceptable	ミニクロスオーバーの中古車探し
acceptable	アトレーの中古車探し
unacceptable	目指せ【声優デビュー】
unacceptable	悪玉コレステロールを下げたい！小林製薬の紅麹コレステヘルプで、気になるコレステロールの薬を
acceptable	蜂の巣駆除をご検討ですか？
acceptable	毎月更新/実例多数掲載中
acceptable	シニア コールセンターの求人
unacceptable	冒険少年漫画も配信
acceptable	グループホームの求人/大阪
acceptable	サラシノール配合のメタバリアEX
unacceptable	【オフィシャル】オリックス生命
acceptable	【死亡保険】世帯主に万が一の事があった場合の必要生活資金は平均5,558万円。ご相談は保険市場
unacceptable	法人の方は決算書5期分と本人確認書類5点で最短即日融資法人お金借りる診断は繰り返し利用可能
unacceptable	【5】ビジネスローン自営業融資
acceptable	登戸駅の賃貸物件情報あり。ライフスタイルを豊かにする情報や最新の賃貸物件を多数ご用意！
acceptable	約100種の条件からあなたにマッチした福岡市の賃貸マンションを選べる・【更新頻度最短5分】
acceptable	ポスター制作をプロに丸投げ
acceptable	セゾンカードの作り方・利用方法をご紹介。貯まったポイントはお買物や別のポイントにも変換OK
unacceptable	寒い季節にシロアリ駆除一軒家値段洗濯物の乾燥機能が大活躍。便利な機能で生活をもっと快適に。
acceptable	おそうじ本舗/全国加盟店の平均月商約110万円
acceptable	年会費初年度無料
unacceptable	約100種の条件からあなたにマッチした桑名の賃貸アパートを選べる・賃貸情報サイト CHINTAI。
acceptable	ゼクシー公式アプリ・人気の式場や気になる式場を見学して、実際に結婚式の雰囲気を体験しよう！
unacceptable	5番おクレカ簡単審査
unacceptable	≪価格満足度92%≫単身の要件や流れ、草刈り・冷蔵庫などの家具運搬のプロに無料で見積が取れる
unacceptable	保険市場/保険市場おすすめの保険商品
unacceptable	ナイトミンの商品をネットで販売
unacceptable	【新車月額払い】新車のサブスク
acceptable	ファインセーブ保険料はこちら
unacceptable	saisonプラチナビジネスカード
acceptable	こびりついた油汚れもピカピカに
acceptable	結婚式場相談は安心の神奈川で
acceptable	おそうじ本舗/脱サラして独立・開業・起業|ハウスクリーニングのおそうじ本舗おそうじ本舗のフランチャイズはサポート・研修体制が充実。ハウスクリーニング業界未経験でも安心・安定して独立・開業・起業!
acceptable	【公式】ガストの配達
acceptable	おそうじ本舗」ブランドで展開中!全国加盟店の平均月商約110万円
acceptable	住友不動産の戸建
unacceptable	ハイゼットトラックフランス車
